nomDuMusee;adr;cp;ville;telephone1;region;departement;coordonneesFinales
Musée E.J Marey;Hôtel de Ville;21200;BEAUNE;0380245692;BOURGOGNE-FRANCHE-COMTE;CÔTE D’OR;47.026213,4.839367
Musée National de l'Automobile - Collection Schlumpf;192, Avenue de Colmar CS 91096;68051;MULHOUSE CEDEX;0389332323;GRAND EST;HAUT-RHIN;
Musée d'Histoire et d'Archéologie;50, rue André Deprez;62440;HARNES;0321490229;HAUTS-DE-France;PAS-DE-CALAIS;50.447577,2.91073
Musée Départemental de l'Abbaye de Saint-Riquier;B.P. 40003 Saint-Riquier;80146;ABBEVILLE Cedex;0322718220;HAUTS-DE-France;SOMME;
Musée de l'Echevinage;29 ter, Rue Alsace-Lorraine;17100;SAINTES;0546935239;NOUVELLE-AQUITAINE;CHARENTE-MARITIME;45.746016,-0.633108
Musée Départemental de l'Arles Antique;Presqu'île-du-Cirque-Romain B.P. 205;13635;ARLES Cédex;0413315103;PROVENCE-ALPES-CÔTE D'AZUR;BOUCHES DU RHONE;
Musée d'Histoire et d'Archéologie des Baux-de-Provence;Ilot Post Tenebra Lux;13520;LES BAUX DE PROVENCE;0490544599;PROVENCE-ALPES-CÔTE D'AZUR;BOUCHES DU RHONE;43.7214018039,4.81156485939
Musée de la Batellerie du Rhône;154, rue Auguste Vincent;07340;SERRIERES;0475340046;AUVERGNE-RHÔNE-ALPES;ARDECHE;45.317802,4.763254
Musée Bourguignon -  Perrin de Puycousin;8, Place de l'Abbaye;71700;TOURNUS;0385512968;BOURGOGNE-FRANCHE-COMTE;SAONE ET LOIRE;46.566134,4.909274
Musée Géo-Charles;1, Rue Géo-Charles;38130;ECHIROLLES;0476225863;AUVERGNE-RHÔNE-ALPES;ISERE;45.149349,5.699616
Musée des Pénitents Blancs;Place de l'Eglise;63940;MARSAC-EN-LIVRADOIS;0473956008;AUVERGNE-RHÔNE-ALPES;PUY DE DÔME;45.478841,3.728705
Musée National de la Marine;17, Place du Trocadéro;75116;PARIS;0153656969;ÎLE-DE-France;PARIS;48.864591,2.293508
Muséum d'Histoire Naturelle;7, Place des Thermes de Salut;65200;BAGNERES-DE-BIGORRE;0562911205;OCCITANIE;HAUTES-PYRENEES;43.062516,0.146987
Musée du Pays Brignolais;18, Place des Comtes de Provence;83170;BRIGNOLES;0494694518;PROVENCE-ALPES-CÔTE D'AZUR;VAR;43.404216,6.061427
Musée Folklorique du Vieux Lambesc;2, rue du Jas;13410;LAMBESC;0442570301;PROVENCE-ALPES-CÔTE D'AZUR;BOUCHES DU RHONE;43.651927,5.261964
Musée de Salon et de la Crau;Château de l'Empéri 1, Montée du Puech;13300;SALON-DE-PROVENCE;0490562236;PROVENCE-ALPES-CÔTE D'AZUR;BOUCHES DU RHONE;43.6464319995,5.06800446267
Moulin de la Blies - Musée des Techniques Faïencières;125, Avenue de la Blies;57200;SARREGUEMINES;0387989350;GRAND EST;MOSELLE;49.1265,7.080124
Musée des Monuments Français;Palais de Chaillot 1, Place du Trocadéro et du 11 Novembre;75116;PARIS;0158515200;ÎLE-DE-France;PARIS;48.8603821025,2.26201220212
Musée Frédéric Japy;16, Rue Frédéric Japy;90500;BEAUCOURT;0384565752;BOURGOGNE-FRANCHE-COMTE;TERRITOIRE DE BELFORT;47.485011,6.922453
Musée ornithologique Charles-Payraudeau;4, Rue des Noyers;85310;LA-CHAIZE-LE-VICOMTE;0251058784;PAYS DE LA LOIRE;VENDEE;46.671559,-1.297313
Musée Gallo-Romain Sisteron;Hôtel d'Ornano Rue Saunerie;04200;SISTERON;0492615840;PROVENCE-ALPES-CÔTE D'AZUR;ALPES DE HAUTE PROVENCE;44.2004441719,5.9040305038
Musée Gallo-Romain d'Uxellodunum;Palais de la Raymondie Place des Consuls;46600;MARTEL;0565373003;OCCITANIE;LOT;44.9553915789,1.56930926768
Maison de l'Outil  et de la Pensée Ouvrière;7, Rue de La Trinité;10000;TROYES;0325732826;GRAND EST;AUBE;48.29473,4.072849
Musée Gatien Bonnet;8, Cour Pierre Herbin;77405;LAGNY-SUR-MARNE;0164303078;ÎLE-DE-France;SEINE ET MARNE;
Musée d'Histoire Locale de Marchiennes;Place Gambetta;59870;MARCHIENNES;0327992195;HAUTS-DE-France;NORD;50.408685,3.281218
Muséum d'Histoire Naturelle;115, Boulevard Eurvin;62317;BOULOGNE-SUR-MER;0321800980;HAUTS-DE-France;PAS-DE-CALAIS;
Musée Municipal d'Avranches;Place Jean de Saint Avit;50300;AVRANCHES;0233582515;NORMANDIE;MANCHE;48.687599,-1.363588
Ecomusée de la Basse-Seine;Maison du Parc Naturel Régional des Boucles de la Seine Normande - Hameau de l'Eglise B.P. 13;76940;NOTRE-DAME-DE-BLIQUETUIT;0235372316;NORMANDIE;SEINE-MARITIME;49.4548266435,0.725950851811
Musée des Mœurs et Coutumes, Musée du Rouergue;Place Pierre Frontin;12500;ESPALION;0565441991;OCCITANIE;AVEYRON;44.520848,2.760502
Musée du Chaume/Kerhinet/Parc Naturel Régional de Brière;Village de Kerhinet;44410;SAINT-LYPHARD;0240619524;PAYS DE LA LOIRE;LOIRE-ATLANTIQUE;47.363743,-2.349306
Musée de Préhistoire Régionale;Rue Lorédan Larchey;06500;MENTON;0493358464;PROVENCE-ALPES-CÔTE D'AZUR;ALPES-MARITIMES;43.77648,7.503609
Musée Matisse;164, Avenue des Arènes de Cimiez;06000;NICE;0493534053;PROVENCE-ALPES-CÔTE D'AZUR;ALPES-MARITIMES;43.720041,7.276769
Musée d'Histoire et d'Archéologie;11, Rue Camille-Buffardel;26150;DIE;0475224005;AUVERGNE-RHÔNE-ALPES;DRÔME;44.75504,5.369785
"Maison Musée" René Descartes;29, Rue Descartes;37160;DESCARTES;0247597919;CENTRE-VAL DE LOIRE;INDRE ET LOIRE;46.972623,0.699988
Musée Alpin;89, Avenue Michel Croz;74400;CHAMONIX;0450532593;AUVERGNE-RHÔNE-ALPES;HAUTE-SAVOIE;45.923429,6.871049
Musée Historial;Mairie Le Bourg;42260;GREZOLLES;0477625700;AUVERGNE-RHÔNE-ALPES;LOIRE;45.8652813058,3.98967950475
Musée des Beaux-Arts;1, Rue Chrestien-de-Troyes;10000;TROYES;0325762160;GRAND EST;AUBE;48.300638,4.08003
Musée Hôtel le Vergeur;36, Place du Forum;51100;REIMS;0326472075;GRAND EST;MARNE;49.257013,4.034043
Musée des Cultures Guyanaises;78, Rue Mme Payé;97300;CAYENNE;0594314172;GUYANE;GUYANE;4.94156,-52.32837
Musée d'Archéologie et d'Histoire Locale;9, Place Wilson;59220;DENAIN;0327446212;HAUTS-DE-France;NORD;50.327328,3.400252
Musée de Normandie;Le Château;14000;CAEN;0231304760;NORMANDIE;CALVADOS;49.162021,-0.345096
Musée de la Batellerie et des Voies Navigables;Château du Prieuré 3, Place Gévelot;78700;CONFLANS-SAINTE-HONORINE;0134903950;ÎLE-DE-France;YVELINES;49.0000390697,2.09915995955
Musée Municipal;;77580;CRECY-LA-CHAPELLE;;ÎLE-DE-France;SEINE ET MARNE;48.858,2.907321
Musée National du Moyen Age-Thermes de Cluny;6, Place Paul Painlevé;75005;PARIS;0153737800;ÎLE-DE-France;PARIS;48.850325,2.343921
Hôtel Hèbre de Saint-Clément - Musée d'Art et d'Histoire;63-65 avenue de Gaulle;17300;ROCHEFORT;0546829160;NOUVELLE-AQUITAINE;CHARENTE-MARITIME;45.935533,-0.96181
Musées du Parc Naturel Régional de Brière;177, Île de Fedrun;44720;SAINT-JOACHIM;0240916868;PAYS DE LA LOIRE;LOIRE-ATLANTIQUE;47.375856,-2.211677
Musée International de la Chaussure;Portail Roger Vivier Rue Bistour;26100;ROMANS;0475055181;AUVERGNE-RHÔNE-ALPES;DRÔME;45.0550040559,5.03828560506
Maison des Ailleurs - Arthur Rimbaud;Quai Rimbaud;08000;CHARLEVILLE-MEZIERES;0324324470;GRAND EST;ARDENNES;49.776058,4.720484
Musée Tavet Delacour;4, Rue Lemercier;95300;PONTOISE;0130380240;ÎLE-DE-France;VAL D'OISE;49.050929,2.099776
Musée - Conservatoire du Machinisme et des Pratiques Agricoles;Aire Poitou-Charentes de Vouillé Aiffres;79230;PRAHECQ;0549756827;NOUVELLE-AQUITAINE;DEUX-SEVRES;46.2556160002,-0.365723799708
Musée Départemental de Cuzals;;46330;SAULIAC-SUR-CELE;0565534314;OCCITANIE;LOT;44.517064,1.721614
Musée Goya;Hôtel de Ville B.P. 10406;81108;CASTRES Cedex;0563715930;OCCITANIE;TARN;
Musée des Augustins;21, rue de Metz;31000;TOULOUSE;0561222182;OCCITANIE;HAUTE-GARONNE;43.600561,1.445891
Musée des Beaux-Arts;18, Place François Sicard;37000;TOURS;0247056873;CENTRE-VAL DE LOIRE;INDRE ET LOIRE;47.394698,0.694004
Musée de la Bonneterie;Conservation des Musées  2, rue Chrestien de Troyes;10000;TROYES;0325730585;GRAND EST;AUBE;48.2968524808,4.07809709011
Musée municipal de Chauny;28, Rue de la Paix;02300;CHAUNY;0323383259;HAUTS-DE-France;AISNE;49.615394,3.216814
Musée Antoine Vivenel;Hôtel de Songeons-Bicquilley 2, Rue d'Austerlitz;60200;COMPIEGNE;0344202604;HAUTS-DE-France;OISE;49.3992378489,2.8537782842
Musée du 11 Conti - Monnaie de Paris;11, Quai de Conti;75270;PARIS Cedex 06;140465666;ÎLE-DE-France;PARIS;
Musée Fragonard;Ecole Nationale Vétérinaire d'Alfort 7, Avenue du Général de Gaulle;94700;MAISONS-ALFORT;0143967052;ÎLE-DE-France;VAL DE MARNE;48.8058570543,2.4381304073
Musée de la Moto, de l'Automobile et du Vélo;La Manu 3, Rue Clément Krebs;86100;CHATELLERAULT;0549210346;NOUVELLE-AQUITAINE;VIENNE;46.825162468,0.575853305257
Musée Charles Portal - Histoire et Patrimoine;Porte des Ormeaux 1, Rue Saint-Michel;81170;CORDES-SUR-CIEL;0563560611;OCCITANIE;TARN;44.0807353424,1.93361594933
Musée du Vieux Montpellier;Hôtel de Varennes 2, Place Pétrarque;34000;MONTPELLIER;0467660294;OCCITANIE;HERAULT;43.613085594,3.86919806969
Musée Cantini;19, Rue Grignan;13006;MARSEILLE;0491547775;PROVENCE-ALPES-CÔTE D'AZUR;BOUCHES DU RHONE;43.292383,5.378137
MUNAE - Musée National de l'Education;185, rue Eau de Robec;76000;ROUEN;0235076661;NORMANDIE;SEINE-MARITIME;49.441397,1.101667
Maison des Templiers;1, Rue Thomas-Bazin;76490;CAUDEBEC-EN-CAUX;0235969591;NORMANDIE;SEINE-MARITIME;49.52525,0.725969
Musée Départemental de la Réunion - Musée Léon Dierx;28, rue de Paris;97400;SAINT-DENIS;0262202482;LA REUNION;REUNION;-20.883698,55.450251
Tapisserie de Bayeux - MAHB Musée d'Art et d'Histoire Baron Gérard;37 rue du Bienvenu;14400;BAYEUX;0231921421;NORMANDIE;CALVADOS;49.276178,-0.703667
Musée National de la Préhistoire;1 Rue du Musée;24620;LES EYZIES-DE-TAYAC;0553064545;NOUVELLE-AQUITAINE;DORDOGNE;44.93608,1.01363
Musée Départemental de Préhistoire de Solutré;Le Grand Pré;71960;SOLUTRE-POUILLY;0385358324;BOURGOGNE-FRANCHE-COMTE;SAONE ET LOIRE;46.294701,4.728982
Musée Muncipal;135 rue des Déportés et de la Résistance Passage Moïse;89100;SENS;0386838890;BOURGOGNE-FRANCHE-COMTE;YONNE;48.1970131192,3.28915152427
Musée Municipal;Hôtel de ville Place Carnot - B.P. 110;10202;BAR-SUR-AUBE CEDEX;0325270421;GRAND EST;AUBE;
Musée de Pontarlier;2, Place d'Arçon;25300;PONTARLIER;0381388214;BOURGOGNE-FRANCHE-COMTE;DOUBS;46.904221,6.354581
Musée des Beaux-Arts;Palais des Ducs et des Etats de Bourgogne CS 73310;21033;DIJON Cedex;0380745209;BOURGOGNE-FRANCHE-COMTE;CÔTE D’OR;
Maison du Verre et du Cristal;Place Robert Schumann;57960;MEISENTHAL;0387969151;GRAND EST;MOSELLE;48.964887,7.35253
Musée d'Archéologie Bargoin;45, rue Ballainvilliers;63000;CLERMONT-FERRAND;0473426970;AUVERGNE-RHÔNE-ALPES;PUY DE DÔME;45.774229,3.0869
Conservatoire - Musée des Industries Hydroélectriques;Route du Lac Le Verney;38114;VAUJANY;0476807800;AUVERGNE-RHÔNE-ALPES;ISERE;45.1681255777,6.0656743192
Musée du Dolder;57, Rue du Général de Gaulle;68340;RIQUEWIHR;0389479215;GRAND EST;HAUT-RHIN;48.16694,7.297357
Ecomusée d'Alsace;B.P. 71;68190;UNGERSHEIM;0389744474;GRAND EST;HAUT-RHIN;47.8612458222,7.34670995091
Musée Stendhal;1, Rue Hector Berlioz;38000;GRENOBLE;0476544414;AUVERGNE-RHÔNE-ALPES;ISERE;45.192869,5.726204
Musée Municipal de Soissons;Abbaye Saint-Jean-des-Vignes 2, rue de la Congrégation Logis de l'Abbé;02200;SOISSONS;0323933050;HAUTS-DE-France;AISNE;49.3519078898,3.32022130463
Musée Eugène Boudin;Place Erik-Satie B.P. 80049;14602;HONFLEUR cedex;0231895400;NORMANDIE;CALVADOS;
Musée Alphonse-Georges Poulain;12, Rue du Pont;27200;VERNON;0232212809;NORMANDIE;EURE;49.094855,1.484927
Musée des Beaux-Arts;28, Rue Gargoulleau;17000;LA ROCHELLE;0546416465;NOUVELLE-AQUITAINE;CHARENTE-MARITIME;46.161969,-1.151552
Muséum d'histoire naturelle Philadelphe Thomas;2, Place Philadelphe Thomas;81600;GAILLAC;0563573631;OCCITANIE;TARN;43.899632,1.89394
Musée Départemental des Pays De l'Ain;34, rue du Général Delestraint;01000;BOURG-EN-BRESSE;0474321060;AUVERGNE-RHÔNE-ALPES;AIN;46.196543,5.219217
Musée de la Mine;1, Avenue de la République;58260;LA MACHINE;0386509108;BOURGOGNE-FRANCHE-COMTE;NIÈVRE;46.889225,3.463514
Musée d'Histoire Naturelle et d'Ethnographie de Colmar;11, Rue Turenne;68000;COLMAR;0389238415;GRAND EST;HAUT-RHIN;48.073594,7.35872
Musée Archéologique;Mairie de Riez;04500;RIEZ-LA-ROMAINE;0492778930;PROVENCE-ALPES-CÔTE D'AZUR;ALPES DE HAUTE PROVENCE;43.817421,6.093121
Musée du Parlement de Provence et du Vieil Aix;Hôtel Estienne-de-Saint-Jean 17, Rue Gaston de Saporta;13100;AIX-EN-PROVENCE;0442214355;PROVENCE-ALPES-CÔTE D'AZUR;BOUCHES DU RHONE;43.5353485115,5.4345381961
Ecomusée du Roannais;Passage Général Giraud;42300;ROANNE;0477713188;AUVERGNE-RHÔNE-ALPES;LOIRE;46.034216,4.056283
Musée Barthélemy-Thimonnier;Place de l'Hôtel de Ville;69550;AMPLEPUIS;0474890890;AUVERGNE-RHÔNE-ALPES;RHÔNE;45.972623,4.331458
Musée des Beaux-Arts;Place du Palais de Justice;73000;CHAMBERY;0479337503;AUVERGNE-RHÔNE-ALPES;SAVOIE;45.568097,5.919108
Musée des Beaux-Arts;Chapelle des Ursulines Rue Piron;21500;MONTBARD;0380925042;BOURGOGNE-FRANCHE-COMTE;CÔTE D’OR;47.6439282902,4.34417525455
Musée du Pays de Sarrebourg;Rue de la Paix;57400;SARREBOURG;0387080868;GRAND EST;MOSELLE;48.734996,7.055094
Musée de l'Argonne Viard-Morel;Place Général Leclerc;51800;SAINTE-MENEHOULD;0326608021;GRAND EST;MARNE;49.09238,4.898046
Musée Historique;9, Rue du Maréchal Foch B.P. 40261;67504;HAGUENAU Cedex;0388937922;GRAND EST;BAS-RHIN;
Musée Boucher-de-Perthes;24, Rue Gontier-Patin;80100;ABBEVILLE;0322240849;HAUTS-DE-France;SOMME;50.10712,1.833193
Musée Carnavalet-Histoire de Paris;16, Rue de Sévigné;75003;PARIS;0144595858;ÎLE-DE-France;PARIS;48.857573,2.363359
Etablissement Public du Musée et du Domaine National de Versailles;1 Rue de l'Indépendance Américaine;78000;VERSAILLES;0130837588;ÎLE-DE-France;YVELINES;48.803136,2.121586
Les Abattoirs, Musée d'Art Moderne et Contemporain;76, allées Charles-de-Fitte;31300;TOULOUSE;0562485800;OCCITANIE;HAUTE-GARONNE;43.600686,1.428993
Musée Jouve;52, Place Castil-Blaze;84300;CAVAILLON;0490760034;PROVENCE-ALPES-CÔTE D'AZUR;VAUCLUSE;43.836954,5.037895
Musée Ernest Guédon;17, quai Jules-Pabiot;58150;POUILLY-SUR-LOIRE;0386935454;BOURGOGNE-FRANCHE-COMTE;NIÈVRE;47.285947,2.949487
Musée François Rabelais;Maison de la Devinière;37500;SEUILLY;0247959118;CENTRE-VAL DE LOIRE;INDRE ET LOIRE;47.140565,0.179408
Musée Barrois;Esplanade du Château;55000;BAR-LE-DUC;0329761467;GRAND EST;MEUSE;48.771797,5.156074
Musée Pierre Noël - Musée de la Vie dans les Hautes-Vosges;13, Rue Saint-Charles;88100;SAINT-DIE-DES-VOSGES;0329516035;GRAND EST;VOSGES;48.288277,6.95167
Etablissement public du musée d'Orsay et de l'Orangerie - Musée Hébert;Hôtel de Montmorency-Bours 85, Rue du Cherche Midi;75006;PARIS;0142222382;ÎLE-DE-France;PARIS;48.8492531918,2.33300877472
Musée Départemental de l'Ecole de Barbizon - Auberge Ganne;92, Grande Rue;77630;BARBIZON;0160662227;ÎLE-DE-France;SEINE ET MARNE;48.446181,2.602464
Musée du Bocage Normand, ferme du bois Jugan;Ferme de Boisjugan Boulevard de la Commune;50000;SAINT-LO;0233562698;NORMANDIE;MANCHE;49.1199688631,-1.08893981029
Musée de Préhistoire Raymond Touchard;La Sabline 21, Route de Montmorillon  BP 23 B.P. 23;86320;LUSSAC-LES-CHATEAUX;0549833980;NOUVELLE-AQUITAINE;VIENNE;46.3927181385,0.726435061295
Musée d'Art et d'Histoire Georges Turpin;1, Rue de la Vau Saint-Jacques;79200;PARTHENAY;0549645373;NOUVELLE-AQUITAINE;DEUX-SEVRES;46.652064,-0.24942
Musée d'Orbigny-Bernon;2, Rue Saint-Côme;17000;LA ROCHELLE;0546411883;NOUVELLE-AQUITAINE;CHARENTE-MARITIME;46.160696,-1.155323
Musée Portuaire;Entrepôt des Tabacs 9, Quai de la Citadelle;59140;DUNKERQUE;0328633339;HAUTS-DE-France;NORD;51.0306940868,2.33760634
Musée d'Histoire Locale - Mémoire de la Ville;Ancienne Mairie Place du 11 novembre;92500;RUEIL-MALMAISON;0147326650;ÎLE-DE-France;HAUTS DE SEINE;48.8694433502,2.17774350372
Musée d'Art et d'Histoire de Granville;2, Rue Lecarpentier La Haute-Ville;50400;GRANVILLE;0233504410;NORMANDIE;MANCHE;48.8338992843,-1.53304864714
Musée du Textile et du Peigne en Corne;65, Rue Jean Jaurès;09300;LAVELANET;0561038919;OCCITANIE;ARIEGE;42.929884,1.844322
Musée Edmond Rostand;Villa Arnaga Route du Docteur Camino;64250;CAMBO-LES-BAINS;0559298392;NOUVELLE-AQUITAINE;PYRÉNÉES ATLANTIQUES;43.3249246789,-1.42953644285
Musée de la Gendarmerie Nationale;1-3 rue Émile Leclerc;77000;MELUN;0164145464;ÎLE-DE-France;SEINE ET MARNE;48.544959,2.653555
Musée Régional d'Auvergne;10 bis, Rue Delile;63200;RIOM;0473381731;AUVERGNE-RHÔNE-ALPES;PUY DE DÔME;45.895037,3.116254
Musée Municipal;Pôle Culturel - Médiathèque-musée de France Parc du Château;52400;BOURBONNE-LES-BAINS;0325906947;GRAND EST;HAUTE-MARNE;47.9435382189,5.71676869059
Musée Pascal Paoli;Hameau de la Stretta;20218;MOROSAGLIA;0495610497;CORSE;HAUTE-CORSE;42.43772,9.30885
Musée d'Art et d'Histoire;Château du Roi René d'Anjou place de l'Europe;49150;BAUGE;0241826811;PAYS DE LA LOIRE;MAINE-ET-LOIRE;47.5402607075,-0.0974658784366
Musée Leblanc-Duvernois;9 bis, Rue d'Egleny;89000;AUXERRE;0386180550;BOURGOGNE-FRANCHE-COMTE;YONNE;47.795393,3.566248
Musée de Morlaix;Place des Jacobins;29600;MORLAIX;0298880775;BRETAGNE;FINISTERE;48.577109,-3.825372
Musée de la Soierie;9, Boulevard Général Leclerc;42190;CHARLIEU;0477602884;AUVERGNE-RHÔNE-ALPES;LOIRE;46.160301,4.17052
Notre histoire, Musée de Rumilly;5, place de la manufacture;74150;RUMILLY;0450646418;AUVERGNE-RHÔNE-ALPES;HAUTE-SAVOIE;45.861683,5.947732
Musée d'Huez et de l'Oisans;Espace Congrès Palais des Sports Avenue de Brandes;38750;ALPE D'HUEZ;0476112174;AUVERGNE-RHÔNE-ALPES;ISERE;45.0970333607,6.08483184334
Musée des Transports Urbains, Interurbains et Ruraux;1, Rue Gabriel de Mortillet;77500;CHELLES;0160204550;ÎLE-DE-France;SEINE ET MARNE;48.87682,2.603374
Musée Langlois;Mairie 13, rue du Paradis;14950;BEAUMONT-EN-AUGE;0231648541;NORMANDIE;CALVADOS;49.2830960197,0.0921245287823
Musée de la Mémoire et des Industries Tullistes;1, Rue du 9 juin 1944;19000;TULLE;0555262215;NOUVELLE-AQUITAINE;CORREZE;45.260416,1.751546
Musée-Bibliothèque Pierre-André Benoît;Rue de Brouzen Pôle culturel de Rochebelle;30100;ALES;0466869869;OCCITANIE;GARD;44.1254083661,4.08875764258
Musée Municipal d'Archéologie;14, Place du Postel;84400;APT;0490749530;PROVENCE-ALPES-CÔTE D'AZUR;VAUCLUSE;43.875736,5.397687
Musée du Vieux Pérouges;Rue des Princes Cité médiévale;01800;PEROUGES;0474610088;AUVERGNE-RHÔNE-ALPES;AIN;45.8984701804,5.16340257624
Musée Paul Dini;2, Place Faubert;69400;VILLEFRANCHE-SUR-SAONE;0474683370;AUVERGNE-RHÔNE-ALPES;RHÔNE;45.990936,4.721527
Musée de l'Académie de La Val d'Isère;23, Place Saint-Pierre;73600;MOÛTIERS;0479243180;AUVERGNE-RHÔNE-ALPES;SAVOIE;45.483424,6.532778
Ecomusée Industriel des Forges;Mail François Giovannelli;56650;INZINZAC-LOCHRIST;0297369821;BRETAGNE;MORBIHAN;47.824797,-3.252319
Musée d'Art et d'Archéologie;2, Faubourg Puyrault;45230;CHATILLON-COLIGNY;0238926406;CENTRE-VAL DE LOIRE;LOIRET;47.820625,2.844906
Musée Alexandre Dumas;24, Rue Demoustiers;02600;VILLERS COTTERETS;0323962330;HAUTS-DE-France;AISNE;49.253009,3.089691
Musée d'Art et d'Archéologie;Place Notre Dame;60300;SENLIS;0344248672;HAUTS-DE-France;OISE;49.206462,2.585625
Musée Pillon;Salle du Patrimoine Hôtel de Ville;60240;CHAUMONT-EN-VEXIN;0344490046;HAUTS-DE-France;OISE;49.2430055349,1.88749117657
Musée de la Renaissance - Château d'Ecouen;Château;95440;ECOUEN;0134383850;ÎLE-DE-France;VAL D'OISE;49.015861,2.378418
Muséum d'Histoire Naturelle;1, rue Poivre;97400;SAINT-DENIS DE LA REUNION;0262200219;LA REUNION;REUNION;-20.887712,55.451452
Musée Bossuet;Cité Episcopale 5, Place Charles de Gaulle;77100;MEAUX;0164348445;ÎLE-DE-France;SEINE ET MARNE;48.9417341013,2.89233400365
Musée Hector Berlioz;69, Rue de la République;38260;LA-COTE-SAINT-ANDRE;0474202488;AUVERGNE-RHÔNE-ALPES;ISERE;45.393386,5.261189
Musée de l'Aventure du Son;Place de l'hôtel de ville;89170;SAINT-FARGEAU;0386741306;BOURGOGNE-FRANCHE-COMTE;YONNE;47.641177,3.070647
Muséum - Maison de l'Eau;5, Boulevard Vauban;89000;AUXERRE;0386729640;BOURGOGNE-FRANCHE-COMTE;YONNE;47.796936,3.564362
Hôtel Dieu - Musée Greuze;21, rue de l'hôpital;71700;TOURNUS;0385512350;BOURGOGNE-FRANCHE-COMTE;SAONE ET LOIRE;46.562137,4.910839
Ecomusée de Saint-Dégan;;56400;BREC'H;0297576600;BRETAGNE;MORBIHAN;47.720736,-2.989176
Musée Départemental du Sel;Porte de France;57630;MARSAL;0387011675;GRAND EST;MOSELLE;48.788524,6.60659
Cabinet des Estampes et des Dessins;5, Place du Château;67000;STRASBOURG;0388525000;GRAND EST;BAS-RHIN;48.581108,7.750893
Musée de la Chartreuse;130, Rue des Chartreux;59500;DOUAI;0327713880;HAUTS-DE-France;NORD;50.374404,3.07548
Musée de la Céramique Architecturale;432, Avenue du Maréchal Foch;60390;AUNEUIL;0344477847;HAUTS-DE-France;OISE;49.371591,1.991603
Musée des Sciences - CCSTI;21, Rue du Douanier Rousseau;53000;LAVAL;0243494782;PAYS DE LA LOIRE;MAYENNE;48.065559,-0.77102
Musée Bonnat-Helleu - Musée des Beaux-Arts de Bayonne;5, Rue Jacques-Laffitte;64100;BAYONNE;0559466360;NOUVELLE-AQUITAINE;PYRÉNÉES ATLANTIQUES;43.49213,-1.472317
Collection d'Histoire Naturelle;1, Place de la Cathédrale;86000;POITIERS;0549503300;NOUVELLE-AQUITAINE;VIENNE;46.580584,0.348113
Musée des Docks Romains;2, Place Vivaux;13002;MARSEILLE;0491553600;PROVENCE-ALPES-CÔTE D'AZUR;BOUCHES DU RHONE;43.29647,5.367908
Musée Rural de la Sologne Bourbonnaise;2, Rue de la Poste;03230;BEAULON;;AUVERGNE-RHÔNE-ALPES;ALLIER;46.602165,3.672361
Musée François Rude;8, Rue Vaillant;21000;DIJON;0380745270;BOURGOGNE-FRANCHE-COMTE;CÔTE D’OR;47.32122,5.043978
Musée d'Art Sacré;Monastère des Bernardines 15-17, rue Sainte-Anne;21000;DIJON;0380488090;BOURGOGNE-FRANCHE-COMTE;CÔTE D’OR;47.3229417955,5.03751223305
Musée d'Art et d'Histoire Marcel Dessal;5-7, Place du musée;28100;DREUX;0237501861;CENTRE-VAL DE LOIRE;EURE ET LOIR;48.733472,1.368066
Musée du Château des Adhémars;24 rue du château Plateau de Narbonne;26200;MONTELIMAR;0475006230;AUVERGNE-RHÔNE-ALPES;DRÔME;44.5548199965,4.74796911041
Muséum d'Orléans pour la biodiversité et l'environnement;6, Rue Marcel Proust;45000;ORLEANS;0238546105;CENTRE-VAL DE LOIRE;LOIRET;47.907597,1.909857
Musée palais Fesch;50-52, rue du Cardinal Fesch;20000;AJACCIO;0495262626;CORSE;CORSE DU SUD;41.92184,8.73895
Musée du Feutre;Mairie;08210;MOUZON;0324265076;GRAND EST;ARDENNES;49.628853,5.062746
Musée Jeanne d'Aboville;5, Rue du Général de Gaulle;02800;LA FERE;0323567191;HAUTS-DE-France;AISNE;49.661954,3.367748
Musée des Beaux-Arts et de la Dentelle;25, rue Richelieu;62100;CALAIS;0321464840;HAUTS-DE-France;PAS-DE-CALAIS;50.956724,1.851871
Musée de la Publicité (Les Arts Décoratifs);107, Rue de Rivoli;75010;PARIS;;ÎLE-DE-France;PARIS;48.879953,2.350922
Musée Lambinet;54, Boulevard de la Reine;78000;VERSAILLES;0139503032;ÎLE-DE-France;YVELINES;48.808966,2.130624
Musée des Civilisations de l'Europe et de la Méditerranée - MuCem;7 Promenade Robert Laffont;13002;MARSEILLE;0484351313;PROVENCE-ALPES-CÔTE D'AZUR;BOUCHES DU RHONE;43.297725,5.360374
Musée d'Histoire et d'Archéologie;16 rue Villien;59440;AVESNES-SUR-HELPE;0327611015;HAUTS-DE-France;NORD;50.122668,3.931434
Musée national de la Voiture et du Tourisme (Annexe du musée National du Château de Compiègne);Palais national B.P. 549;60200;COMPIEGNE;0344384700;HAUTS-DE-France;OISE;49.3992378489,2.8537782842
Musée Départemental Pierre Corneille;502, Rue Pierre Corneille;76650;LE PETIT-COURONNE;0235681389;NORMANDIE;SEINE-MARITIME;49.389368,1.0216
Musée Zola-Dreyfus;26, Rue Pasteur;78670;MEDAN;0139753565;ÎLE-DE-France;YVELINES;48.955066,1.995741
Musée Dupuy-Mestreau;4 rue Monconseil;17100;SAINTES;0546933671;NOUVELLE-AQUITAINE;CHARENTE-MARITIME;45.743294,-0.634076
Musée du Papier Peint;La Commanderie  28, rue Zuber B.P. 41;68171;RIXHEIM Cedex;0389642456;GRAND EST;HAUT-RHIN;
Musée Balzac;Château de Saché;37190;SACHE;0247268650;CENTRE-VAL DE LOIRE;INDRE ET LOIRE;47.245773,0.54394
Planétarium/Musée de l'Ancien Collège des Jésuites;49, Avenue du Général de Gaulle;51100;REIMS;0326353470;GRAND EST;MARNE;49.242853,4.01526
Historial et Mémorial de la Vendée;;85170;LES LUCS-SUR-BOULOGNE;0251476161;PAYS DE LA LOIRE;VENDEE;46.843567,-1.494167
Musée de l'Abbaye de Sainte-Croix;Rue de Verdun;85100;LES SABLES D'OLONNE;0251320116;PAYS DE LA LOIRE;VENDEE;46.497541,-1.777258
Musée Ingres;BP 752;82013;MONTAUBAN Cedex;0563221291;OCCITANIE;TARN-ET-GARONNE;
Musée de la poste;6, Rue Joyeuse;37400;AMBOISE;0147570011;CENTRE-VAL DE LOIRE;INDRE ET LOIRE;47.411309,0.984736
Jardin d'Hiver, Musée de La Faïence;15-17, Rue Poincaré;57200;SARREGUEMINES;0387989350;GRAND EST;MOSELLE;49.109069,7.070473
Musée Jules Bastien-Lepage - Musée de la Fortification;La Citadelle - Ville Haute B.P. 28;55600;MONTMEDY;0329801590;GRAND EST;MEUSE;49.5005989637,5.37522814726
Musée de la Coutellerie;Place Charles de Gaulle;52800;NOGENT;0325318921;GRAND EST;HAUTE-MARNE;48.027445,5.341363
Musée des Arts Décoratifs;Palais Rohan 2, Place du Château;67000;STRASBOURG;0388525000;GRAND EST;BAS-RHIN;48.5716222333,7.76768232804
Musée Historique de Troyes et de la Champagne;4, Rue Vauluisant;10000;TROYES;0325423333;GRAND EST;AUBE;48.294239,4.071824
Musée Archéologique;Allée des Potiers;11590;SALLELES D'AUDE;0468468948;OCCITANIE;AUDE;43.268326,2.939055
Musée des Beaux-Arts de Béziers;Place de la Révolution;34500;BEZIERS;0467283878;OCCITANIE;HERAULT;43.341552,3.210676
Musée de l'Empéri de Salon et de la Crau;Montée du Puech;13300;SALON-DE-PROVENCE;0490447280;PROVENCE-ALPES-CÔTE D'AZUR;BOUCHES DU RHONE;43.639115,5.097941
Muséum - Musée des Confluences;86 quai Perrache;69002;LYON;0428381190;AUVERGNE-RHÔNE-ALPES;RHÔNE;45.733757,4.817611
Musée Municipal Marcel Sahut;2, rue des Ecoles;63530;VOLVIC;0473335733;AUVERGNE-RHÔNE-ALPES;PUY DE DÔME;45.860584,3.024326
Musée Lapidaire Saint-Nicolas;Rue Saint Nicolas;71400;AUTUN;0385523571;BOURGOGNE-FRANCHE-COMTE;SAONE ET LOIRE;46.955535,4.300118
Musée Volcanologique Franck Arnold Perret;Rue Victor Hugo;97250;SAINT-PIERRE;0596781516;MARTINIQUE;MARTINIQUE;14.74303,-61.176361
Musée du Château de Fontainebleau;Château de Fontainebleau;77300;FONTAINEBLEAU;0160715070;ÎLE-DE-France;SEINE ET MARNE;48.401659,2.700845
