nomDuMusee;adr;cp;ville;telephone1;region;departement;coordonneesFinales
Musée Municipal Camille Pautet;27, Rue St-Nazaire;84380;MAZAN;0490697501;PROVENCE-ALPES-CÔTE D'AZUR;VAUCLUSE;44.056725,5.127889
Musée du Vieux-Logis de Nice;59, Avenue Saint Barthélémy;06000;NICE;0493844474;PROVENCE-ALPES-CÔTE D'AZUR;ALPES-MARITIMES;43.706469,7.254912
Musée Archéologique - Site de  Cimiez;Site de Cimiez 160, Avenue des Arènes;06000;NICE;0493815957;PROVENCE-ALPES-CÔTE D'AZUR;ALPES-MARITIMES;43.7122279855,7.23752896461
Château de Grignan;Le Château;26230;GRIGNAN;0475918357;AUVERGNE-RHÔNE-ALPES;DRÔME;44.419274,4.90924
Musée-Maison Natale Gustave Courbet;1, Place Robert Fernier;25290;ORNANS;0381622330;BOURGOGNE-FRANCHE-COMTE;DOUBS;47.104874,6.147697
Musée Municipal d'Archéologie;26, rue Baronne Delort;39300;CHAMPAGNOLE;0384530129;BOURGOGNE-FRANCHE-COMTE;JURA;46.74651,5.907547
Musée d'Art et d'Histoire;Cour Francis Renaud Rue des Lycéens Martyrs;22000;SAINT-BRIEUC;0296625520;BRETAGNE;COTES D'ARMOR;48.5146037386,-2.76180979127
Musée de la Carte Postale;Le Quatro 3, Avenue Jean Moulin;56150;BAUD;0297511514;BRETAGNE;MORBIHAN;47.8954786966,-3.01425366823
Maison de l'Archéologie des Vosges du Nord;44, Avenue Foch;67110;NIEDERBRONN-LES-BAINS;0388803637;GRAND EST;BAS-RHIN;48.947443,7.650429
Musée de Zoologie - Aquarium Tropical;34, Rue Sainte-Catherine;54000;NANCY;0383329997;GRAND EST;MEURTHE ET MOSELLE;48.695072,6.188467
Musée de l'Histoire du Fer;1, Avenue du Général de Gaulle B.P. 15;54140;JARVILLE-LA-MALGRANGE;0383152770;GRAND EST;MEURTHE ET MOSELLE;48.6669142212,6.20534540639
Musée Yves Saint Laurent;5, Avenue Marceau;75116;PARIS Cedex 16;0144316400;ÎLE-DE-France;PARIS;48.867895,2.298877
Musée National Jean-Jacques Henner;43, Avenue de Villiers;75017;PARIS;0147636437;ÎLE-DE-France;PARIS;48.883045,2.307689
Musée des Années Trente;Espace Landowski 28, avenue André Morizet;92100;BOULOGNE-BILLANCOURT;0155184642;ÎLE-DE-France;HAUTS DE SEINE;48.8364966292,2.23867632216
Musée Municipal des Beaux-Arts de Limoges - Palais de l'Evêché;1, Place de l'Evêché;87000;LIMOGES;0555459810;NOUVELLE-AQUITAINE;HAUTE VIENNE;45.828784,1.265445
Musée d'Histoire Naturelle et de Préhistoire;13 Bis, Bd Amiral Courbet;30033;NIMES Cedex 9;0466767345;OCCITANIE;GARD;
Maison de l'Eclusier/Parc Naturel Régional de Brière;Rozé Place des Eclusiers;44550;SAINT-MALO DE GUERSAC;0240916031;PAYS DE LA LOIRE;LOIRE-ATLANTIQUE;47.3304711447,-2.15365906277
Musée d'Art et d'Histoire;65, Rue de France;06000;NICE;0493911910;PROVENCE-ALPES-CÔTE D'AZUR;ALPES-MARITIMES;43.695672,7.259251
Musée Ziem;9, Boulevard du 14 Juillet;13500;MARTIGUES;0442413960;PROVENCE-ALPES-CÔTE D'AZUR;BOUCHES DU RHONE;43.408336,5.054107
Musée des Beaux-Arts de Marseille;Palais Longchamp Aile gauche;13004;MARSEILLE;0491145930;PROVENCE-ALPES-CÔTE D'AZUR;BOUCHES DU RHONE;43.306734414,5.4008326497
Musée Lansyer;1, rue Lansyer;37600;LOCHES;0247594821;CENTRE-VAL DE LOIRE;INDRE ET LOIRE;47.126829,0.997457
Musée des Beaux-Arts;1, rue Fernand Rabier;45000;ORLEANS;0238792155;CENTRE-VAL DE LOIRE;LOIRET;47.903147,1.909903
Musée des Beaux-Arts de Brest;24, Rue Traverse;29200;BREST;0298008797;BRETAGNE;FINISTERE;48.385326,-4.490018
Musée Marcel Proust;4, rue du Docteur Proust;28120;ILLIERS-COMBRAY;0237243097;CENTRE-VAL DE LOIRE;EURE ET LOIR;48.29985,1.243452
Musée des Beaux-Arts;Direction des Affaires culturelles 29, Cloître Notre-Dame;28000;CHARTRES;0237904580;CENTRE-VAL DE LOIRE;EURE ET LOIR;48.4472286537,1.50557775943
Musée des Arts Décoratifs;Hôtel Lallemant 5, Rue de l'Hôtel Lallemant;18000;BOURGES;0248578117;CENTRE-VAL DE LOIRE;CHER;47.0747448585,2.40489595766
Musée de la Céramique;Rue Jean Macé B.P. 107;62240;DESVRES;0321832323;HAUTS-DE-France;PAS-DE-CALAIS;50.6791586942,1.86161910061
Musée Nissim de Camondo (Les Arts Décoratifs);63, Rue de Monceau;75008;PARIS;0153890650;ÎLE-DE-France;PARIS;48.878849,2.312855
Musée du Domaine Départemental de Sceaux;Château de Sceaux;92330;SCEAUX;0141872950;ÎLE-DE-France;HAUTS DE SEINE;48.774707,2.299025
Musée National de Port Royal des Champs;Route des Granges;78114;MAGNY-LES-HAMEAUX;0139307272;ÎLE-DE-France;YVELINES;48.748152,2.015991
Musée Municipal - Collections Paul et André Véra;Espace Paul et André Véra 2, Rue Henri IV;78100;SAINT-GERMAIN-EN-LAYE;0139730264;ÎLE-DE-France;YVELINES;48.9409298615,2.0992045515
Musée de l'Hôtel Dubocage de Bléville;1, Rue Jérôme Bellarmato;76600;LE HAVRE;0235422790;NORMANDIE;SEINE-MARITIME;49.488697,0.114414
Musée d'Histoire et d'Archéologique;Logis Mallet;33330;SAINT-EMILION;0557247209;NOUVELLE-AQUITAINE;GIRONDE;44.8802992664,-0.154465376932
Villa-Musée Jean-Honoré Fragonard;23, Boulevard Fragonard;06130;GRASSE;0493365298;PROVENCE-ALPES-CÔTE D'AZUR;ALPES-MARITIMES;43.65674,6.921089
Musée des Beaux-Arts;9, Rue de la République;83300;DRAGUIGNAN;0498102685;PROVENCE-ALPES-CÔTE D'AZUR;VAR;43.537982,6.464818
Musée Archéologique;Hôtel de Ville;41140;THESEE;0254714020;CENTRE-VAL DE LOIRE;LOIR ET CHER;47.31763,1.323402
Musée du Jouet Pierre Pinel;1, Enclos de l'Abbaye;78300;POISSY;0139650606;ÎLE-DE-France;YVELINES;48.928536,2.03784
Musée du Site Médiéval;;24440;SAINT-AVIT-SENIEUR;0553223227;NOUVELLE-AQUITAINE;DORDOGNE;44.77393,0.815624
Muséum d'Histoire Naturelle;15 Place Pierre Semard;34500;BEZIERS;0467368161;OCCITANIE;HERAULT;43.343271,3.211298
Musée de la Mer;Fort Royal de l'Ile-Sainte-Marguerite;06400;CANNES;0493385526;PROVENCE-ALPES-CÔTE D'AZUR;ALPES-MARITIMES;43.5526938306,7.00247889833
Musée d'Art Sacré;Le Village;26540;MOURS SAINT-EUSEBE;0475029695;AUVERGNE-RHÔNE-ALPES;DRÔME;45.068744,5.056328
Musée de la Lutherie et de l'Archèterie Française;Cours Stanislas;88500;MIRECOURT;0329378159;GRAND EST;VOSGES;48.301314,6.13577
Musée de La Thiérache;Place de l'Hôtel de ville;02140;VERVINS;0323582461;HAUTS-DE-France;AISNE;49.834696,3.907654
La Piscine - Musée d'Art et d'Industrie André Diligent de Roubaix;23, Rue de l'Espérance;59100;ROUBAIX;0320692360;HAUTS-DE-France;NORD;50.693026,3.16791
Musée et Sites archéologiques de Vieux-la-Romaine;13, Chemin Haussé;14930;VIEUX;0231711020;NORMANDIE;CALVADOS;49.105412,-0.431321
Musée des Beaux-Arts;Le Château;14000;CAEN;0231304770;NORMANDIE;CALVADOS;49.162021,-0.345096
Musée Archéologique du Lauragais;Rampe du Presidial B.P. 1100;11491;CASTELNAUDARY Cedex;0468600369;OCCITANIE;AUDE;
Musée Bernadotte;8, Rue Tran;64000;PAU;0559274842;NOUVELLE-AQUITAINE;PYRÉNÉES ATLANTIQUES;43.297209,-0.372526
Musée de Bibracte;Mont Beuvray Col du Rebout;71990;SAINT-LEGER-SOUS BEUVRAY;;BOURGOGNE-FRANCHE-COMTE;SAONE ET LOIRE;46.934539,4.062979
Musée du Vieux Pommiers;Mairie Le Bourg;42260;POMMIERS-EN-FOREZ;0477654063;AUVERGNE-RHÔNE-ALPES;LOIRE;45.8652813058,3.98967950475
Ecomusée du Pays de Montfort;2, Rue du Château;35160;MONTFORT-SUR-MEU;0299093181;BRETAGNE;ILE ET VILAINE;48.137716,-1.956162
Musée International du Long-Cours Cap-Hornier;Tour Solidor Esplanade du Commandant Menguy - B.P. 147;35401;SAINT-MALO CEDEX;0299407116;BRETAGNE;ILE ET VILAINE;
Musée Hôtel Morin;60, Rue Concorde B.P. 247;37402;AMBOISE Cedex;0247234742;CENTRE-VAL DE LOIRE;INDRE ET LOIRE;
Musée Camille Claudel;10, Ri=ue Gustave Flaubert;10400;NOGENT-SUR-SEINE;0325247634;GRAND EST;AUBE;48.494371,3.500954
Musée de l'Œuvre Notre-Dame;3, Place du Château;67000;STRASBOURG;0388525000;GRAND EST;BAS-RHIN;48.58107,7.751247
Musée Gassendi;64, Bd Gassendi;04000;DIGNE-LES-BAINS;0492314529;PROVENCE-ALPES-CÔTE D'AZUR;ALPES DE HAUTE PROVENCE;44.092826,6.235477
Musée d'Art et d'Histoire;Abbaye St-Germain 2 bis, Place Saint-Germain;89000;AUXERRE;0386180550;BOURGOGNE-FRANCHE-COMTE;YONNE;47.8006402501,3.56347649804
Musée d'Art Moderne;14, Place Saint-Pierre;10000;TROYES;0325762680;GRAND EST;AUBE;48.299799,4.080736
Maison du Patrimoine de Hières-sur-Amby;Montée de la Cure;38118;HIERES SUR AMBY;0474951910;AUVERGNE-RHÔNE-ALPES;ISERE;45.797238,5.293984
Musée d'Archéologie Tricastine;Place Castellane;26131;SAINT-PAUL-TROIS-CHATEAUX;0475047419;AUVERGNE-RHÔNE-ALPES;DRÔME;
Musée Mathon-Durand;53, Grande Rue Saint-Pierre;76270;NEUFCHATEL-EN-BRAY;0235930655;NORMANDIE;SEINE-MARITIME;49.733695,1.433507
Musée de l'Ardoise et de la Géologie;"Longchamp";53800;RENAZE;0243064014;PAYS DE LA LOIRE;MAYENNE;47.793467,-1.041358
Musée du Nord de la Vendée;Place de l'Hôtel de ville B.P. 227;85602;MONTAIGU Cedex;0251092121;PAYS DE LA LOIRE;VENDEE;
Muséon Arlaten;29, Rue de la République;13200;ARLES;0490935811;PROVENCE-ALPES-CÔTE D'AZUR;BOUCHES DU RHONE;43.676331,4.62752
Ecomusée de Margeride-Haute-Auvergne;La Tour Jardin de Saint-Martin;15320;RUYNES-EN-MARGERIDE;0471234296;AUVERGNE-RHÔNE-ALPES;CANTAL;44.9755512909,3.25916489345
Musée Léon Marès;Château de Montrottier 60, Allée du Château;74330;LOVAGNY;0450462302;AUVERGNE-RHÔNE-ALPES;HAUTE-SAVOIE;45.9569347655,6.04448277364
Musée de la Résistance et de la Déportation;5, Place Carnegie Fargniers;02700;TERGNIER;0323579377;HAUTS-DE-France;AISNE;49.6402663387,3.29629531322
Atelier - Musée du Papier;134, Rue de Bordeaux;16000;ANGOULEME;0545927343;NOUVELLE-AQUITAINE;CHARENTE;45.653356,0.149932
Musée des Beaux-Arts;Rue Cité Foulc;30033;NIMES Cedex 9;0466767191;OCCITANIE;GARD;
Musée Pyrénéen;Château fort;65100;LOURDES;0562423737;OCCITANIE;HAUTES-PYRENEES;43.095689,-0.048488
Musée des tourneurs sur Bois;Place de la Résistance;83630;AIGUINES;0494709917;PROVENCE-ALPES-CÔTE D'AZUR;VAR;43.775313,6.243184
Musée Comtadin-Duplessis;Bibliothèque-musée Inguimbertine 234, Boulevard Albin-Durand;84200;CARPENTRAS;0490630492;PROVENCE-ALPES-CÔTE D'AZUR;VAUCLUSE;44.059163985,5.06111954826
Musée de la Résistance Bretonne;Les Hardys-Behelec;56140;SAINT-MARCEL - MALESTROIT;0297751690;BRETAGNE;MORBIHAN;47.801537,-2.431908
Musée de l'Alta Rocca;Quartier Prato;20170;LEVIE;0495780078;CORSE;CORSE DU SUD;41.70389,9.12555
Musée Historique;2, Rue du Vieux Marché aux Poissons;67000;STRASBOURG;0388525000;GRAND EST;BAS-RHIN;48.580496,7.749675
Musée d'Art et d'Archéologie;Centre Culturel Pierre Mendès France 37, rue des Carmes;15012;AURILLAC Cedex;0471454610;AUVERGNE-RHÔNE-ALPES;CANTAL;
Musée Matheysin;Maison Caral Rue du Colonel Escallon;38350;LA MURE;0476309815;AUVERGNE-RHÔNE-ALPES;ISERE;44.9382346863,5.8349163639
Galerie de Botanique (Muséum National National d'Histoire Naturelle);18 rue Buffon;75005;PARIS;;ÎLE-DE-France;PARIS;48.842024,2.359052
Musée Municipal;60-62, Avenue du Consul Général Nordling;93190;LIVRY-GARGAN;0143887146;ÎLE-DE-France;SEINE SAINT-DENIS;48.91694,2.532418
Musée d'Art et d'Histoire de Lisieux;38, Boulevard Pasteur;14100;LISIEUX;0231620770;NORMANDIE;CALVADOS;49.144581,0.219329
Musée Henri Barré;7, rue Marie de la Tour d'Auvergne;79100;THOUARS;0549663697;NOUVELLE-AQUITAINE;DEUX-SEVRES;46.973531,-0.217936
Musée Municipal;Esplanade Charles de Gaulle;33190;LA REOLE;0556611068;NOUVELLE-AQUITAINE;GIRONDE;44.581128,-0.041074
Musée du Percheron;3, Rue du Portail Saint-Denis;61400;MORTAGNE-AU-PERCHE;0233252587;NORMANDIE;ORNE;48.52186,0.54697
Musée Municipal des Beaux-Arts;Rue Mathieu Lalanne;64000;PAU;0559273302;NOUVELLE-AQUITAINE;PYRÉNÉES ATLANTIQUES;43.297273,-0.364361
Site Archéologique Lattara - Musée Henri Prades de Montpellier Agglomération;390, Avenue de Pérols;34970;LATTES Cédex;0467997720;OCCITANIE;HERAULT;43.566729,3.908384
Musée d'Art et d'Archéologie Hôtel Fouquet;2, Rue Jean Bourré;53200;CHATEAU-GONTIER;0243095598;PAYS DE LA LOIRE;MAYENNE;47.828879,-0.705135
Musée Archéologique;Parvis de la Vieille Eglise;83700;SAINT-RAPHAËL;0494192575;PROVENCE-ALPES-CÔTE D'AZUR;VAR;43.425688,6.769154
Musée Jean-Charles Cazin;84, Grand' Place Foch;62830;SAMER;0321335064;HAUTS-DE-France;PAS-DE-CALAIS;50.63954,1.745547
Château-musée de Nemours;Rue Gautier 1er;77140;NEMOURS;0164282742;ÎLE-DE-France;SEINE ET MARNE;48.265559,2.696199
Musée des Jacobins;4, Place Louis Blanc;32000;AUCH;0562057479;OCCITANIE;GERS;43.647171,0.587482
Musée des Ursulines;5, rue des Ursulines;71000;MACON;0385399038;BOURGOGNE-FRANCHE-COMTE;SAONE ET LOIRE;46.307159,4.832892
Musée Colette;Château;89520;SAINT-SAUVEUR-EN-PUISAYE;0386456195;BOURGOGNE-FRANCHE-COMTE;YONNE;47.617677,3.199325
Musée Lapidaire Saint-Pierre;Place Saint-Pierre;38200;VIENNE;0474852035;AUVERGNE-RHÔNE-ALPES;ISERE;45.523327,4.870902
Musée des Beaux-Arts et d'Archéologie;Place de Miremont;38200;VIENNE;0474787104;AUVERGNE-RHÔNE-ALPES;ISERE;45.524092,4.874677
Musée - Atelier Rodin (Annexe du musée de Paris);19, Avenue Auguste Rodin;92190;MEUDON;0141143500;ÎLE-DE-France;HAUTS DE SEINE;48.813854,2.25249
Musée de l'Hôtel d'Espeyran;6, bis rue Montpelliéret;34000;MONTPELLIER;0467148300;OCCITANIE;HERAULT;43.611156,3.879596
Musée des Beaux-Arts;Avenue Dom-Vayssette;81600;GAILLAC;0563571825;OCCITANIE;TARN;43.894261,1.901851
Musée Municipal;Rue Jean Jaurès;85000;LA ROCHE-SUR-YON;0251474835;PAYS DE LA LOIRE;VENDEE;46.669421,-1.428889
Musée Dauphinois;30, Rue Maurice Gignoux;38031;GRENOBLE Cedex 1;0457588901;AUVERGNE-RHÔNE-ALPES;ISERE;
Musée de Pont-Aven;Place Julia;29930;PONT-AVEN;0298061443;BRETAGNE;FINISTERE;47.855514,-3.747063
Ecomusée du Pays de Rennes;Ferme de la Bintinais Route de Noyal-Châtillon-sur-Seiche;35200;RENNES;0299513815;BRETAGNE;ILE ET VILAINE;48.1116364246,-1.6816378334
Musée Départemental Matisse;Palais Fénelon Place du Commandant Richez;59360;LE CATEAU-CAMBRESIS;0359733800;HAUTS-DE-France;NORD;50.0869230183,3.58161803685
Musée Léon Alègre;24, avenue Paul Langevin;30200;BAGNOLS-SUR-CEZE;0466897400;OCCITANIE;GARD;44.164783,4.62103
Musée Renoir;Chemin des Collettes;06800;CAGNES-SUR-MER;0493206107;PROVENCE-ALPES-CÔTE D'AZUR;ALPES-MARITIMES;43.674267,7.154969
Musée du Château des Ducs de Wurtemberg;B.P. 95287;25205;MONTBELIARD Cedex;0381992261;BOURGOGNE-FRANCHE-COMTE;DOUBS;
Musée Précolombien Edgar Clerc;440 Route de la Rosette;97160;LE MOULE;0590235757;GUADELOUPE;GUADELOUPE;16.34023,-61.382538
Musée Municipal des Emaux et Faïences;Port de France Rue de la Manutention;54400;LONGWY;0382238519;GRAND EST;MEURTHE ET MOSELLE;49.5244232599,5.7294177983
Musée de la Poterie;2, rue de Kuhlendorf;67660;BETSCHDORF;0388544807;GRAND EST;BAS-RHIN;48.900348,7.914409
Musée de la Bataille de Tilly-Sur-Seulles 1944;Chapelle Notre Dame du Val;14250;TILLY-SUR-SEULLES;0231809210;NORMANDIE;CALVADOS;49.175029,-0.628262
Musée Toulouse Lautrec;Palais de la Berbie B.P. 100;81003;ALBI Cedex;0563494870;OCCITANIE;TARN;
Musée Municipal de Guéthary;Parc municipal André Narbaits  117, Avenue du Général de Gaulle;64210;GUETHARY;0559548637;NOUVELLE-AQUITAINE;PYRÉNÉES ATLANTIQUES;43.4226559085,-1.56911488604
Musée des Beaux-Arts de Saint-Denis;8, Rue Chanzy;51100;REIMS;0326353600;GRAND EST;MARNE;49.25323,4.031072
Musée de l'Ostrevant;192, rue Edouard Lalo;59111;BOUCHAIN;0327357397;HAUTS-DE-France;NORD;50.284651,3.311321
Musée de Montmartre;12, Rue Cortot;75018;PARIS;0149258937;ÎLE-DE-France;PARIS;48.887709,2.340577
Musée Municipal de la Vignasse;Mairie Rue de l'Hôtel de ville;30300;BEAUCAIRE;0466599007;OCCITANIE;GARD;43.780193328,4.58229884673
Musée de l'Ardoise;32, Chemin de la Maraîchère;49800;TRELAZE;0241690471;PAYS DE LA LOIRE;MAINE-ET-LOIRE;47.450792,-0.491518
Musée du Peigne et de la Plasturgie;Centre Culturel Aragon Place Georges Pompidou;01100;OYONNAX;0474819682;AUVERGNE-RHÔNE-ALPES;AIN;46.2468792013,5.65226081977
LAM - Lille Métropole Musée d'Art Moderne, d'Art Contemporain et d'Art Brut;1, Allée du Musée;59650;VILLENEUVE-D'ASCQ;0320196868;HAUTS-DE-France;NORD;50.637497,3.148587
Musée-Jardin Paul Landowski;14, Rue Max Blondat;92100;BOULOGNE-BILLANCOURT;0146058269;ÎLE-DE-France;HAUTS DE SEINE;48.844261,2.246847
Ecomusée;Ferme de Coulevrain Place Georges Henri Rivière;77176;SAVIGNY-LE-TEMPLE;0164410123;ÎLE-DE-France;SEINE ET MARNE;48.5856002138,2.56311279324
Musée du Débarquement;Place du 6 Juin;14117;ARROMANCHES;0231223431;NORMANDIE;CALVADOS;49.34004,-0.62139
Musée Archéologique;Esplanade André Malraux;17100;SAINTES;0546742097;NOUVELLE-AQUITAINE;CHARENTE-MARITIME;45.741649,-0.62815
Musée Historique de l'Hydravion;332, Avenue Louis Breguet;40600;BISCARROSSE;0558780065;NOUVELLE-AQUITAINE;LANDES;44.388887,-1.182563
Musée National de la Marine;Château de Brest;29240;BREST;0298221239;BRETAGNE;FINISTERE;
Musée du Cloître de Notre-Dame-en-Vaux;Rue Nicolas Durant;51000;CHALONS-EN-CHAMPAGNE;0326640387;GRAND EST;MARNE;48.958112,4.362901
Musée du Château de Vitré;Place du Château;35506;VITRE Cedex;0299750454;BRETAGNE;ILE ET VILAINE;
Musée d'archéologie d'Aleria - Jérôme Carcopino;Hameau du Fort;20270;ALERIA;0495570092;CORSE;HAUTE-CORSE;42.10452,9.51118
Muséum d'Histoire Naturelle;"Les Jacobins"  Rue Anne de Bretagne;41000;BLOIS;0254742100;CENTRE-VAL DE LOIRE;LOIR ET CHER;47.612940364,1.32071876619
Musée d'Histoire et d'Archéologie;Bastion Saint André;06600;ANTIBES;0493958598;PROVENCE-ALPES-CÔTE D'AZUR;ALPES-MARITIMES;43.594375,7.102294
Musée Raymond Lafage;10, Rue Victor Mazies;81310;LISLE-SUR-TARN;0563404545;OCCITANIE;TARN;43.852891,1.811372
Musée d'Histoire de Figeac;Rue Victor Delbos Cour du Puy;46100;FIGEAC;0565340625;OCCITANIE;LOT;44.6196578758,1.99907921588
Musée Municipal;12, Rue Camille Rodier;21700;NUITS-SAINT-GEORGES;0380620137;BOURGOGNE-FRANCHE-COMTE;CÔTE D’OR;47.138661,4.950405
Musée Hébert;Chemin Hébert;38700;LA TRONCHE;0476429735;AUVERGNE-RHÔNE-ALPES;ISERE;45.205577,5.7513
Établissement Public de la Porte Dorée - Musée de l’Histoire de l’Immigration;Palais de la Porte Dorée 293, avenue Daumesnil;75012;PARIS;0153595860;ÎLE-DE-France;PARIS;48.8347421662,2.42053665524
Musée d'Ethnographie et d'Arts Populaires et Musée de la Marine;Musée du Vieux Honfleur B.P. 60082;14603;HONFLEUR;0231891412;NORMANDIE;CALVADOS;
Musée Départemental d'Histoire et d'Archéologie;Abbaye d'Arthous;40300;HASTINGUES;0558730389;NOUVELLE-AQUITAINE;LANDES;43.524707,-1.121476
Atelier-Musée  (Ecomusée de la Grande Landes);101, Rue Jacques Desert;40043;LUXEY;0558080139;NOUVELLE-AQUITAINE;LANDES;
Musée Jean Jaurès;2, Place Pélisson;81100;CASTRES;0563624183;OCCITANIE;TARN;43.607135,2.240474
Musée de l'Artisanat Jurassien;Abbaye de Baume-Les-Messieurs;39210;VOITEUR;0384873300;BOURGOGNE-FRANCHE-COMTE;JURA;46.707619,5.64848
Musée Beurnier-Rossel;8, Place Saint-Martin B.P. 95287;25200;MONTBELIARD;0381992261;BOURGOGNE-FRANCHE-COMTE;DOUBS;47.5248285421,6.80015635102
Forge-Musée;2, Rue de Lamadeleine;90170;ETUEFFONT;0384546041;BOURGOGNE-FRANCHE-COMTE;TERRITOIRE DE BELFORT;47.722575,6.920842
Musée Jeanne d'Arc;15, Rue Jeanne d'Arc;55140;VAUCOULEURS;0329895182;GRAND EST;MEUSE;48.601395,5.666054
Musée Départemental du Textile;Rue de la Rive;81270;LA-BASTIDE-ROUAIROUX;0563980860;OCCITANIE;TARN;43.476809,2.638421
Musée Camarguais;Mas du Pont de Rousty;13200;ARLES;0490971082;PROVENCE-ALPES-CÔTE D'AZUR;BOUCHES DU RHONE;43.623694,4.529959
Musée d'Art Moderne et Contemporain de Saint-Etienne Métropole;Rue Fernand Léger;42270;SAINT-PRIEST-EN-JAREZ;0477795252;AUVERGNE-RHÔNE-ALPES;LOIRE;45.474874,4.377088
Musée Lapidaire;Place de l'Abbaye;63200;MOZAC;0473389994;AUVERGNE-RHÔNE-ALPES;PUY DE DÔME;45.892085,3.094626
Le Carroi, Musée d’Arts et d’Histoire;44, Rue Haute-Saint-Maurice;37500;CHINON;0247931812;CENTRE-VAL DE LOIRE;INDRE ET LOIRE;47.167125,0.23767
Musée Estève;Hôtel des Echevins 13, Rue Edouard Branly;18000;BOURGES;0248247538;CENTRE-VAL DE LOIRE;CHER;47.0747448585,2.40489595766
Musée de l'Image;42 quai de Dogneville;88000;EPINAL;0329814830;GRAND EST;VOSGES;48.183628,6.445992
Musée National des Techniques (Conservatoire National des Arts et Métiers);292, rue Saint-Martin;75141;PARIS cedex 03;0153018200;ÎLE-DE-France;PARIS;
Musée d'Art et d'Histoire;11, Rue des Pierres;92190;MEUDON;0146238713;ÎLE-DE-France;HAUTS DE SEINE;48.806412,2.234894
Musée des Arts Décoratifs de l’Océan indien (MADOI);17 A, Chemin Rouge;97450;SAINT-LOUIS;0262912430;LA REUNION;REUNION;-21.26765,55.411839
Musée des Beaux-Arts;Centre Culturel Jean Lurçat Place du Champ de Mars;50000;SAINT-LO;0233725255;NORMANDIE;MANCHE;49.1199688631,-1.08893981029
Musée d'Histoire de Marseille;2 Rue Henri Barbusse;13001;MARSEILLE;0491553600;PROVENCE-ALPES-CÔTE D'AZUR;BOUCHES DU RHONE;43.298168,5.374162
Musée du Temps;96, Grande rue;25000;BESANCON;0381878161;BOURGOGNE-FRANCHE-COMTE;DOUBS;47.235978,6.0268
Musée du docteur Faure;Villa "Les Chimères" 10, Boulevard des Côtes;73100;AIX-LES-BAINS;0479610657;AUVERGNE-RHÔNE-ALPES;SAVOIE;45.7110465411,5.94212260662
Musée de Préhistoire J. Miln- Z. Le-Rouzic;10, Place de la chapelle;56340;CARNAC;0297522204;BRETAGNE;MORBIHAN;47.584531,-3.079164
Muséum d'Histoire Naturelle de Grenoble;1, Rue Dolomieu B.P. 3022;38816;GRENOBLE Cedex 1;0476440535;AUVERGNE-RHÔNE-ALPES;ISERE;
Musée Municipal;Parc du Prélong;63790;MUROL;0473886006;AUVERGNE-RHÔNE-ALPES;PUY DE DÔME;45.574777,2.94325
Ferme-Musée du Cotentin;1, Chemin de Beauvais;50480;SAINTE-MERE-EGLISE;0233954020;NORMANDIE;MANCHE;49.414681,-1.318106
Musée du Textile;Rue du Docteur Roux;49300;CHOLET;0241752550;PAYS DE LA LOIRE;MAINE-ET-LOIRE;47.069587,-0.897687
Musée Communautaire Opale-Sud;60, Rue de l'Impératrice;62600;BERCK-SUR-MER;0321840780;HAUTS-DE-France;PAS-DE-CALAIS;50.405092,1.567687
Musée des Beaux-Arts;Place du Général de Gaulle B.P. 4212;59378;DUNKERQUE CEDEX;0328592165;HAUTS-DE-France;NORD;
Musée des Automates;Hôtel Arturo Lopez 12, Rue du Centre;92200;NEUILLY-SUR-SEINE;0155626090;ÎLE-DE-France;HAUTS DE SEINE;48.8855663756,2.26645990318
Muséum Agricole et Industriel Stella Matutina;6,Allée des Flamboyants;97424;PITON-SAINT-LEU;0262341624;LA REUNION;REUNION;-21.202292,55.295071
Musée ethnographique et archéologique du Donjon;Rue Du Guesclin;79000;NIORT;0549787200;NOUVELLE-AQUITAINE;DEUX-SEVRES;46.332326,-0.463764
Musée Régional de Fouras;Esplanade de la Légion d'Honneur Fort Vauban BP 70026;17450;FOURAS;0546841523;NOUVELLE-AQUITAINE;CHARENTE-MARITIME;45.9868352342,-1.03911420802
Musée National Gustave Moreau;14, Rue de la Rochefoucauld;75009;PARIS;0148743850;ÎLE-DE-France;PARIS;48.877878,2.334383
Ecomusée du Mont Lozère;Quartier de l'Estournal;48220;LE PONT DE MONTVERT;0466458073;OCCITANIE;LOZERE;44.365187,3.745745
Musée des Troupes de Marine;Avenue du Musée des Troupes de Marine B.P. 94;83608;FREJUS Cedex;0494178782;PROVENCE-ALPES-CÔTE D'AZUR;VAR;
Musée des Arts Naïfs et Populaires de Noyers sur Serein;25, Rue de l'Eglise;89310;NOYERS-SUR-SEREIN;0386828909;BOURGOGNE-FRANCHE-COMTE;YONNE;47.72104,3.966631
Musée Départemental de la Montagne Albert Demard;Château-Lambert;70440;LE HAUT-DU-THEM;0384204309;BOURGOGNE-FRANCHE-COMTE;HAUTE-SAONE;47.842654,6.721916
Musée de la Faïence et des Beaux-Arts;16, rue Saint-Genest;58000;NEVERS;0386684460;BOURGOGNE-FRANCHE-COMTE;NIÈVRE;46.98629,3.155037
Musée Lucien Mainssieux;7, Place Léon Chaloin;38500;VOIRON;0476656717;AUVERGNE-RHÔNE-ALPES;ISERE;45.356091,5.579679
Musée Adrien Mentienne;1, Grande Rue Charles de Gaulle;94360;BRY-SUR-MARNE;0145166833;ÎLE-DE-France;VAL DE MARNE;48.835224,2.519827
Musée National des Châteaux de Malmaison et de Bois-Préau;Avenue du Château de Malmaison;92500;RUEIL-MALMAISON;0141290555;ÎLE-DE-France;HAUTS DE SEINE;48.872881,2.169064
Musée Régional du Cidre et du Calvados;Rue du Petit Versailles;50700;VALOGNES;0233402273;NORMANDIE;MANCHE;49.505988,-1.47042
Musée Municipal de Cognac;48, Bd Denfert Rochereau;16100;COGNAC;0545320725;NOUVELLE-AQUITAINE;CHARENTE;45.695744,-0.326186
Musée Archéologique;Place de la République;32180;EAUZE;0562097138;OCCITANIE;GERS;
Musée du Bois;1, Place de la République;01420;SEYSSEL;0450562155;AUVERGNE-RHÔNE-ALPES;AIN;45.959254,5.831685
Musée de la Dombes;Maison de la Dombes;01330;VILLARS DE LA DOMBES;;AUVERGNE-RHÔNE-ALPES;AIN;46.000448,5.026912
Conservatoire du Machinisme et des Pratiques Agricoles;1, rue de la République;28300;CHARTRES-MAINVILLIERS;0237841500;CENTRE-VAL DE LOIRE;EURE ET LOIR;48.446888,1.476576
Musée d'Archéologie;3, Rue Victor de Laprade;42110;FEURS;0477262448;AUVERGNE-RHÔNE-ALPES;LOIRE;45.744191,4.219803
Musée Francisque Mandet;14, Rue de l'Hôtel de Ville;63200;RIOM;0473381853;AUVERGNE-RHÔNE-ALPES;PUY DE DÔME;45.893874,3.116508
Musée de la Vie Bourguignonne, Perrin de Puycousin;Monastère des Bernardines 15-17, rue Sainte-Anne;21000;DIJON;0380488090;BOURGOGNE-FRANCHE-COMTE;CÔTE D’OR;47.3229417955,5.03751223305
Musée Napoléon Ier;34, Rue de l'Ecole Militaire;10500;BRIENNE-LE-CHATEAU;0325928241;GRAND EST;AUBE;48.388915,4.528446
Musée du Vignoble et des Vins d'Alsace;Château de la Confrérie St-Etienne Kientzheim;68240;KAYSERSBERG VIGNOBLE;0389782136;GRAND EST;HAUT-RHIN;48.1678355817,7.21603176483
Musée du Granit;Le Bourg;50670;SAINT-MICHEL-DE-MONTJOIE;0233590222;NORMANDIE;MANCHE;48.751916,-1.038517
Cité Internationale de la Dentelle et de la Mode de Calais;135, Quai du Commerce;62100;CALAIS;0321004230;HAUTS-DE-France;PAS-DE-CALAIS;50.950474,1.860013
L'Adresse Musée de la Poste;34, Boulevard de Vaugirard;75731;PARIS Cedex 15;0142792336;ÎLE-DE-France;PARIS;
Musée Industriel de la Corderie Vallois;185, Route de Dieppe;76960;NOTRE-DAME-DE-BONDEVILLE;0235743535;NORMANDIE;SEINE-MARITIME;49.494507,1.048567
Musée du baptistère Saint-Jean;Rue Jean Jaurès;86000;POITIERS;0549412124;NOUVELLE-AQUITAINE;VIENNE;46.580519,0.346104
Muséum d'Histoire Naturelle de Nantes;12, Rue Voltaire;44000;NANTES;0240992620;PAYS DE LA LOIRE;LOIRE-ATLANTIQUE;47.212387,-1.564651
Musée de Préhistoire du Grand Pressigny;Château du Grand-Pressigny;37350;LE GRAND PRESSIGNY;0247949020;CENTRE-VAL DE LOIRE;INDRE ET LOIRE;46.92224,0.804273
Château Musée;31/33 Rue Hersent Luzarche;36290;AZAY-LE-FERRON;0254392006;CENTRE-VAL DE LOIRE;INDRE;46.851361,1.069524
Maison de la Magie;1, Place du Château;41000;BLOIS;0254552626;CENTRE-VAL DE LOIRE;LOIR ET CHER;47.586104,1.332126
